{"collection_mode":"incremental_feed","finished_at":"2026-10-16T11:32:27.479763Z","manifest_version":"1.0","metrics":{"created":4,"errors":0,"events_created":4,"events_updated":0,"excluded":0,"finalized":25,"included":25,"normalized":25,"privacy_allowed":25,"privacy_quarantined":0,"privacy_rejected":0,"publication_approved":25,"publication_hold":0,"publication_rejected":0,"seen":25,"unchanged":21,"updated":0},"requested_scope":{"type":"bdns_incremental_update","value":"region=56;from=2026-09-30;to=2026-10-15;temporal_policy=fecha-recepcion-provisional-v1"},"run_id":"run-v1-4387d38e-185c-4a0e-bbaf-758e3ecc12ea","software_metadata":{"collector_version":"0.2.0","git_commit_sha":"5f114e8a41736919e858d3c2a567381e82b6786b","source_contract_version":"1"},"source_id":"bdns","started_at":"2026-10-16T11:31:47.638383Z","status":"success"}
