{"collection_mode":"incremental_feed","finished_at":"2026-09-24T15:13:58.588241Z","manifest_version":"1.0","metrics":{"created":0,"errors":0,"events_created":0,"events_updated":0,"excluded":201,"finalized":0,"included":0,"normalized":0,"privacy_allowed":0,"privacy_quarantined":0,"privacy_rejected":0,"publication_approved":0,"publication_hold":0,"publication_rejected":0,"seen":201,"unchanged":0,"updated":0},"requested_scope":{"type":"date","value":"2026-09-24"},"run_id":"run-v1-90713ad8-3d99-4696-a157-52a92f21953f","software_metadata":{"collector_version":"0.1.0","git_commit_sha":"4946cace59b1289f59d91d6b22f9b91176ce0b7c","source_contract_version":"1"},"source_id":"boe","started_at":"2026-09-24T15:13:56.474442Z","status":"success"}
