{"collection_mode":"incremental_feed","finished_at":"2026-10-25T14:57:56.935747Z","manifest_version":"1.0","metrics":{"created":0,"errors":0,"events_created":0,"events_updated":0,"excluded":0,"finalized":0,"included":0,"normalized":0,"privacy_allowed":0,"privacy_quarantined":0,"privacy_rejected":0,"publication_approved":0,"publication_hold":0,"publication_rejected":0,"seen":0,"unchanged":0,"updated":0},"requested_scope":{"type":"date","value":"2026-10-25"},"run_id":"run-v1-a477b5c0-62a9-430c-89eb-0d58f73999d0","software_metadata":{"collector_version":"0.1.0","git_commit_sha":"dde0af2e8fcc8e39f0e4d7698f456e36423afe7a","source_contract_version":"1"},"source_id":"boe","started_at":"2026-10-25T14:57:56.445305Z","status":"no_publication"}
