{"collection_mode":"incremental_feed","finished_at":"2026-09-27T15:11:16.333283Z","manifest_version":"1.0","metrics":{"created":0,"errors":0,"events_created":0,"events_updated":0,"excluded":0,"finalized":0,"included":0,"normalized":0,"privacy_allowed":0,"privacy_quarantined":0,"privacy_rejected":0,"publication_approved":0,"publication_hold":0,"publication_rejected":0,"seen":0,"unchanged":0,"updated":0},"requested_scope":{"type":"date","value":"2026-09-27"},"run_id":"run-v1-d5efb01f-2b29-4e7e-8dcc-e11ec691f895","software_metadata":{"collector_version":"0.1.0","git_commit_sha":"711c6cfa28c5aaceee21089f85ef07f4b7ceae0f","source_contract_version":"1"},"source_id":"boe","started_at":"2026-09-27T15:11:15.717701Z","status":"no_publication"}
