{"collection_mode":"incremental_feed","finished_at":"2026-10-24T14:02:14.117015Z","manifest_version":"1.0","metrics":{"created":0,"errors":0,"events_created":0,"events_updated":0,"excluded":323,"finalized":1,"included":1,"normalized":1,"privacy_allowed":1,"privacy_quarantined":0,"privacy_rejected":0,"publication_approved":0,"publication_hold":1,"publication_rejected":0,"seen":324,"unchanged":0,"updated":0},"requested_scope":{"type":"date","value":"2026-10-24"},"run_id":"run-v1-a8e1d93d-31b4-49f6-bf55-10ca093e6ecf","software_metadata":{"collector_version":"0.1.0","git_commit_sha":"b331153ea59184375555ef756000fa8dae84ac6d","source_contract_version":"1"},"source_id":"boe","started_at":"2026-10-24T14:02:12.550608Z","status":"success"}
