{"collection_mode":"incremental_feed","finished_at":"2026-09-28T18:11:36.900358Z","manifest_version":"1.0","metrics":{"created":0,"errors":0,"events_created":0,"events_updated":0,"excluded":317,"finalized":6,"included":6,"normalized":6,"privacy_allowed":6,"privacy_quarantined":0,"privacy_rejected":0,"publication_approved":0,"publication_hold":6,"publication_rejected":0,"seen":323,"unchanged":0,"updated":0},"requested_scope":{"type":"date","value":"2026-09-28"},"run_id":"run-v1-27fc90d9-4169-42c4-b751-996e96246ec0","software_metadata":{"collector_version":"0.1.0","git_commit_sha":"800ccd309a3a19c8b16f92273b571475f68fa6b4","source_contract_version":"1"},"source_id":"boe","started_at":"2026-09-28T18:11:34.830180Z","status":"success"}
