{"collection_mode":"incremental_feed","finished_at":"2026-10-09T17:01:57.588342Z","manifest_version":"1.0","metrics":{"created":0,"errors":0,"events_created":0,"events_updated":0,"excluded":235,"finalized":2,"included":2,"normalized":2,"privacy_allowed":2,"privacy_quarantined":0,"privacy_rejected":0,"publication_approved":0,"publication_hold":2,"publication_rejected":0,"seen":237,"unchanged":0,"updated":0},"requested_scope":{"type":"date","value":"2026-10-09"},"run_id":"run-v1-05a4aa11-b3f2-47f2-9938-dce67fbb8a75","software_metadata":{"collector_version":"0.1.0","git_commit_sha":"2313994357718624009adc8e6f40279cf5e729ef","source_contract_version":"1"},"source_id":"boe","started_at":"2026-10-09T17:01:55.359058Z","status":"success"}
