{"collection_mode":"incremental_feed","finished_at":"2026-10-01T17:03:27.545045Z","manifest_version":"1.0","metrics":{"created":0,"errors":0,"events_created":0,"events_updated":0,"excluded":198,"finalized":2,"included":2,"normalized":2,"privacy_allowed":2,"privacy_quarantined":0,"privacy_rejected":0,"publication_approved":0,"publication_hold":2,"publication_rejected":0,"seen":200,"unchanged":0,"updated":0},"requested_scope":{"type":"date","value":"2026-10-01"},"run_id":"run-v1-aedd92db-cddc-45a2-92c0-94f65f04a96f","software_metadata":{"collector_version":"0.1.0","git_commit_sha":"53a22a82321273fdedce490feaf2c39015ef1b89","source_contract_version":"1"},"source_id":"boe","started_at":"2026-10-01T17:03:26.006150Z","status":"success"}
