{"collection_mode":"incremental_feed","finished_at":"2026-10-23T15:10:48.990965Z","manifest_version":"1.0","metrics":{"created":0,"errors":0,"events_created":0,"events_updated":0,"excluded":283,"finalized":1,"included":1,"normalized":1,"privacy_allowed":1,"privacy_quarantined":0,"privacy_rejected":0,"publication_approved":0,"publication_hold":1,"publication_rejected":0,"seen":284,"unchanged":0,"updated":0},"requested_scope":{"type":"date","value":"2026-10-23"},"run_id":"run-v1-9070f05f-0bd4-451a-bd59-fa9b1b78d0fb","software_metadata":{"collector_version":"0.1.0","git_commit_sha":"cded3e539fedddc9ca797e1f5087cb4f4dbde3a8","source_contract_version":"1"},"source_id":"boe","started_at":"2026-10-23T15:10:46.449091Z","status":"success"}
