{"collection_mode":"incremental_feed","finished_at":"2026-10-06T16:50:44.191484Z","manifest_version":"1.0","metrics":{"created":0,"errors":0,"events_created":0,"events_updated":0,"excluded":248,"finalized":3,"included":3,"normalized":3,"privacy_allowed":3,"privacy_quarantined":0,"privacy_rejected":0,"publication_approved":0,"publication_hold":3,"publication_rejected":0,"seen":251,"unchanged":0,"updated":0},"requested_scope":{"type":"date","value":"2026-10-06"},"run_id":"run-v1-1c736860-0196-4777-8e9d-ac938a6b5edc","software_metadata":{"collector_version":"0.1.0","git_commit_sha":"6263777889caff8f9506f7fdf0e82328ecb1f899","source_contract_version":"1"},"source_id":"boe","started_at":"2026-10-06T16:50:42.070826Z","status":"success"}
