{"collection_mode":"incremental_feed","error_summary":{"error_code":"item_ingestion_failure","safe_message":"El procesamiento de la fuente falló antes de completar el lote.","stage":"run"},"finished_at":"2026-10-08T13:38:15.833574Z","manifest_version":"1.0","metrics":{"created":0,"errors":2,"events_created":0,"events_updated":0,"excluded":0,"finalized":0,"included":0,"normalized":0,"privacy_allowed":0,"privacy_quarantined":0,"privacy_rejected":0,"publication_approved":0,"publication_hold":0,"publication_rejected":0,"seen":33,"unchanged":0,"updated":0},"requested_scope":{"type":"bdns_incremental_update","value":"region=56;from=2026-09-22;to=2026-10-07;temporal_policy=fecha-recepcion-provisional-v1"},"run_id":"run-v1-fa8364bb-c551-4092-82b1-8140fc60be33","software_metadata":{"collector_version":"0.2.0","git_commit_sha":"8eece6943c51ab12e1f9d81d7bb97bad8ba602a8","source_contract_version":"1"},"source_id":"bdns","started_at":"2026-10-08T13:38:12.768127Z","status":"failed"}
