{"collection_mode":"incremental_feed","finished_at":"2026-10-15T15:06:27.463474Z","manifest_version":"1.0","metrics":{"created":0,"errors":0,"events_created":0,"events_updated":0,"excluded":163,"finalized":1,"included":1,"normalized":1,"privacy_allowed":1,"privacy_quarantined":0,"privacy_rejected":0,"publication_approved":0,"publication_hold":1,"publication_rejected":0,"seen":164,"unchanged":0,"updated":0},"requested_scope":{"type":"date","value":"2026-10-15"},"run_id":"run-v1-a2982449-0fcf-4778-b93d-e8b027ae19af","software_metadata":{"collector_version":"0.1.0","git_commit_sha":"975369285120f2832f40b23ed6070ff95faae032","source_contract_version":"1"},"source_id":"boe","started_at":"2026-10-15T15:06:26.007586Z","status":"success"}
