{"collection_mode":"incremental_feed","finished_at":"2026-10-22T15:21:14.608863Z","manifest_version":"1.0","metrics":{"created":0,"errors":0,"events_created":0,"events_updated":0,"excluded":246,"finalized":2,"included":2,"normalized":2,"privacy_allowed":2,"privacy_quarantined":0,"privacy_rejected":0,"publication_approved":0,"publication_hold":2,"publication_rejected":0,"seen":248,"unchanged":0,"updated":0},"requested_scope":{"type":"date","value":"2026-10-22"},"run_id":"run-v1-b2570041-178b-4578-b680-42f9fc0856e5","software_metadata":{"collector_version":"0.1.0","git_commit_sha":"ea30f3585a15d1e8f0eda8088ebc1147f6d0e825","source_contract_version":"1"},"source_id":"boe","started_at":"2026-10-22T15:21:12.584409Z","status":"success"}
