{"collection_mode":"incremental_feed","finished_at":"2026-10-20T15:10:03.308003Z","manifest_version":"1.0","metrics":{"created":0,"errors":0,"events_created":0,"events_updated":0,"excluded":249,"finalized":7,"included":7,"normalized":7,"privacy_allowed":7,"privacy_quarantined":0,"privacy_rejected":0,"publication_approved":0,"publication_hold":7,"publication_rejected":0,"seen":256,"unchanged":0,"updated":0},"requested_scope":{"type":"date","value":"2026-10-20"},"run_id":"run-v1-56d04fa7-5142-4682-ac2d-6b7cb770ad78","software_metadata":{"collector_version":"0.1.0","git_commit_sha":"bd432e11a9d2b6f11ee368fd3b2f557523111cb7","source_contract_version":"1"},"source_id":"boe","started_at":"2026-10-20T15:10:00.965490Z","status":"success"}
