{"collection_mode":"incremental_feed","finished_at":"2026-10-26T17:25:49.262831Z","manifest_version":"1.0","metrics":{"created":0,"errors":0,"events_created":0,"events_updated":0,"excluded":315,"finalized":3,"included":3,"normalized":3,"privacy_allowed":3,"privacy_quarantined":0,"privacy_rejected":0,"publication_approved":0,"publication_hold":3,"publication_rejected":0,"seen":318,"unchanged":0,"updated":0},"requested_scope":{"type":"date","value":"2026-10-26"},"run_id":"run-v1-b73b3160-6d70-4131-b8be-0d3a82f629b4","software_metadata":{"collector_version":"0.1.0","git_commit_sha":"0c8732ba31aee6a13683ef197c82df06a51a646c","source_contract_version":"1"},"source_id":"boe","started_at":"2026-10-26T17:25:47.117867Z","status":"success"}
