{"collection_mode":"incremental_feed","finished_at":"2026-10-17T13:47:24.749281Z","manifest_version":"1.0","metrics":{"created":0,"errors":0,"events_created":0,"events_updated":0,"excluded":263,"finalized":7,"included":7,"normalized":7,"privacy_allowed":7,"privacy_quarantined":0,"privacy_rejected":0,"publication_approved":0,"publication_hold":7,"publication_rejected":0,"seen":270,"unchanged":0,"updated":0},"requested_scope":{"type":"date","value":"2026-10-17"},"run_id":"run-v1-f65e2a9e-3552-4011-85da-fa250d8c6c42","software_metadata":{"collector_version":"0.1.0","git_commit_sha":"4dd9695ba3c7a317143b75feeae93d16e0e29944","source_contract_version":"1"},"source_id":"boe","started_at":"2026-10-17T13:47:23.115130Z","status":"success"}
