{"collection_mode":"incremental_feed","finished_at":"2026-10-27T16:43:17.960709Z","manifest_version":"1.0","metrics":{"created":0,"errors":0,"events_created":0,"events_updated":0,"excluded":284,"finalized":5,"included":5,"normalized":5,"privacy_allowed":5,"privacy_quarantined":0,"privacy_rejected":0,"publication_approved":0,"publication_hold":5,"publication_rejected":0,"seen":289,"unchanged":0,"updated":0},"requested_scope":{"type":"date","value":"2026-10-27"},"run_id":"run-v1-22446969-03df-4a34-a291-70f737be5195","software_metadata":{"collector_version":"0.1.0","git_commit_sha":"b267e5191aed35c84efe6dd3fa63e9d3eb7a3b40","source_contract_version":"1"},"source_id":"boe","started_at":"2026-10-27T16:43:16.180735Z","status":"success"}
