{"collection_mode":"incremental_feed","finished_at":"2026-09-25T15:19:43.489429Z","manifest_version":"1.0","metrics":{"created":0,"errors":0,"events_created":0,"events_updated":0,"excluded":187,"finalized":0,"included":0,"normalized":0,"privacy_allowed":0,"privacy_quarantined":0,"privacy_rejected":0,"publication_approved":0,"publication_hold":0,"publication_rejected":0,"seen":187,"unchanged":0,"updated":0},"requested_scope":{"type":"date","value":"2026-09-25"},"run_id":"run-v1-bce5696f-b709-4b6a-931e-57f663239b3d","software_metadata":{"collector_version":"0.1.0","git_commit_sha":"f48111f794432c3981ec06a59611626920f62427","source_contract_version":"1"},"source_id":"boe","started_at":"2026-09-25T15:19:41.928256Z","status":"success"}
