{"collection_mode":"incremental_feed","finished_at":"2026-10-05T19:19:06.217918Z","manifest_version":"1.0","metrics":{"created":0,"errors":0,"events_created":0,"events_updated":0,"excluded":316,"finalized":2,"included":2,"normalized":2,"privacy_allowed":2,"privacy_quarantined":0,"privacy_rejected":0,"publication_approved":0,"publication_hold":2,"publication_rejected":0,"seen":318,"unchanged":0,"updated":0},"requested_scope":{"type":"date","value":"2026-10-05"},"run_id":"run-v1-78eed030-f98a-4284-b790-98dac51c0b64","software_metadata":{"collector_version":"0.1.0","git_commit_sha":"7fec65459a0971b6e8192a5a54a151b5ca44c80e","source_contract_version":"1"},"source_id":"boe","started_at":"2026-10-05T19:19:03.687734Z","status":"success"}
