{"collection_mode":"incremental_feed","finished_at":"2026-10-16T14:54:56.395891Z","manifest_version":"1.0","metrics":{"created":0,"errors":0,"events_created":0,"events_updated":0,"excluded":214,"finalized":3,"included":3,"normalized":3,"privacy_allowed":3,"privacy_quarantined":0,"privacy_rejected":0,"publication_approved":0,"publication_hold":3,"publication_rejected":0,"seen":217,"unchanged":0,"updated":0},"requested_scope":{"type":"date","value":"2026-10-16"},"run_id":"run-v1-9aeda862-8254-409e-9ca9-e494d047a09d","software_metadata":{"collector_version":"0.1.0","git_commit_sha":"161c1f3855fa9a79b22c93c37b95a5832d4cb2ab","source_contract_version":"1"},"source_id":"boe","started_at":"2026-10-16T14:54:54.300225Z","status":"success"}
