{"collection_mode":"incremental_feed","error_summary":{"error_code":"source_failure","safe_message":"La ejecución de la fuente no produjo un resultado utilizable.","stage":"transport"},"finished_at":"2026-10-02T16:17:49.020758Z","manifest_version":"1.0","metrics":{"created":0,"errors":1,"events_created":0,"events_updated":0,"excluded":0,"finalized":0,"included":0,"normalized":0,"privacy_allowed":0,"privacy_quarantined":0,"privacy_rejected":0,"publication_approved":0,"publication_hold":0,"publication_rejected":0,"seen":0,"unchanged":0,"updated":0},"requested_scope":{"type":"date","value":"2026-10-02"},"run_id":"run-v1-703c2d14-1a52-4ba4-8333-e182631b7b5b","software_metadata":{"collector_version":"0.1.0","git_commit_sha":"e63396d79737b86f6710694b1a0a4ec531b0e289","source_contract_version":"1"},"source_id":"boe","started_at":"2026-10-02T16:17:48.171156Z","status":"failed"}
