{"collection_mode":"incremental_feed","finished_at":"2026-10-18T05:12:54.437079Z","manifest_version":"1.0","metrics":{"created":1,"errors":0,"events_created":1,"events_updated":0,"excluded":198,"finalized":2,"included":2,"normalized":2,"privacy_allowed":2,"privacy_quarantined":0,"privacy_rejected":0,"publication_approved":1,"publication_hold":1,"publication_rejected":0,"seen":200,"unchanged":0,"updated":0},"requested_scope":{"type":"date","value":"2026-10-01"},"run_id":"run-v1-78cd3a0b-f01a-4ca0-93be-7b5c7ee9768c","software_metadata":{"collector_version":"0.1.0","git_commit_sha":"bd51fabb3ade64e175833ce810efcec76454016a","source_contract_version":"1"},"source_id":"boe","started_at":"2026-10-18T05:12:52.838808Z","status":"success"}
