{"collection_mode":"incremental_feed","finished_at":"2026-09-26T14:33:06.962970Z","manifest_version":"1.0","metrics":{"created":0,"errors":0,"events_created":0,"events_updated":0,"excluded":369,"finalized":6,"included":6,"normalized":6,"privacy_allowed":6,"privacy_quarantined":0,"privacy_rejected":0,"publication_approved":0,"publication_hold":6,"publication_rejected":0,"seen":375,"unchanged":0,"updated":0},"requested_scope":{"type":"date","value":"2026-09-26"},"run_id":"run-v1-8c04a8b4-c643-4b5c-b287-90ea5735c5f5","software_metadata":{"collector_version":"0.1.0","git_commit_sha":"5909acf28d5f164502cb9dc77b675852df46490c","source_contract_version":"1"},"source_id":"boe","started_at":"2026-09-26T14:33:04.880475Z","status":"success"}
