{"collection_mode":"incremental_feed","finished_at":"2026-10-29T17:27:25.094411Z","manifest_version":"1.0","metrics":{"created":0,"errors":0,"events_created":0,"events_updated":0,"excluded":207,"finalized":2,"included":2,"normalized":2,"privacy_allowed":2,"privacy_quarantined":0,"privacy_rejected":0,"publication_approved":0,"publication_hold":2,"publication_rejected":0,"seen":209,"unchanged":0,"updated":0},"requested_scope":{"type":"date","value":"2026-10-29"},"run_id":"run-v1-8c2f5aeb-9186-48c7-9602-4d18ea23bf73","software_metadata":{"collector_version":"0.1.0","git_commit_sha":"ceb2a1077c82a5ae114d5c8a2c57f4772fb2003b","source_contract_version":"1"},"source_id":"boe","started_at":"2026-10-29T17:27:23.452892Z","status":"success"}
